Noisy,Clean
मा ने कहा वहा मत जाओ,"माँ ने कहा, वहाँ मत जाओ।"
क्या तुम चलोगे मुझे बहुत काम है,क्या तुम चलोगे? मुझे बहुत काम है।
में कल घर जाऊंगा और मा से मिलूंगा,मैं कल घर जाऊँगा और माँ से मिलूँगा।
वहा कहा लिखा है कि रास्ता बंद है,वहाँ कहाँ लिखा है कि रास्ता बंद है?
क्या आप जानते हैं दरवाजा खुला है,क्या आप जानते हैं? दरवाजा खुला है।
में बाजार जा रहा हु मा ने बुलाया है,मैं बाज़ार जा रहा हूँ माँ ने बुलाया है।
कहा जा रहे हो अभी तो धूप बहुत है,कहाँ जा रहे हो? अभी तो धूप बहुत है।
में वहा जाऊंगा जहा सब मिलते हैं,मैं वहाँ जाऊँगा जहाँ सब मिलते हैं।
क्या तुम मेरे साथ चलोगे मुझे बाज़ार जाना है,क्या तुम मेरे साथ चलोगे? मुझे बाज़ार जाना है।
भाई आजकल तुम कहा रहते हो मा पूछ रही थी,भाई! आजकल तुम कहाँ रहते हो? माँ पूछ रही थी।
में थक गया हु अब में सोना चाहता हु,मैं थक गया हूँ। अब मैं सोना चाहता हूँ।
क्या तुमने खाना खाया वहा बहुत भीड़ थी,क्या तुमने खाना खाया? वहाँ बहुत भीड़ थी।
में जानता हु कि तुम वहा नहीं जाओगे,मैं जानता हूँ कि तुम वहाँ नहीं जाओगे।
कहा लिखा है कि में गलत हु,कहाँ लिखा है कि मैं गलत हूँ?
क्या तुम आओगे रास्ता साफ़ है,क्या तुम आओगे? रास्ता साफ़ है।
मा ने खाना बनाया है में अभी आ रहा हु,माँ ने खाना बनाया है। मैं अभी आ रहा हूँ।
वहा मत जाना जहा बिजली कड़क रही हो,वहाँ मत जाना जहाँ बिजली कड़क रही हो।
क्या आप जानते हैं कि में कहा हु,क्या आप जानते हैं कि मैं कहाँ हूँ?
में कल आऊंगा वहा बहुत काम है,मैं कल जाऊँगा। वहाँ बहुत काम है।
कहा हो तुम मा परेशान हो रही है,कहाँ हो तुम? माँ परेशान हो रही है।
में और मा वहा साथ जाएंगे,मैं और माँ वहाँ साथ जाएंगे।
क्या तुम जानते हो में कहा से आया हु,क्या तुम जानते हो मैं कहाँ से आया हूँ?
में वहा खड़ा था जहा बारिश हो रही थी,मैं वहाँ खड़ा था जहाँ बारिश हो रही थी।
मा ने पूछा कहा जा रहे हो,"माँ ने पूछा, ""कहाँ जा रहे हो?"""
क्या तुम चलोगे मुझे मा से मिलना है,क्या तुम चलोगे? मुझे माँ से मिलना है।
में घर पर हु वहा कोई नहीं है,मैं घर पर हूँ। वहाँ कोई नहीं है।
कहा लिखा है कि मा घर पर नहीं है,कहाँ लिखा है कि माँ घर पर नहीं है?
में कल जाऊंगा वहा सब इंतज़ार कर रहे हैं,मैं कल जाऊँगा। वहाँ सब इंतज़ार कर रहे हैं।
क्या तुम जानते हो वहा क्या हुआ,क्या तुम जानते हो वहाँ क्या हुआ?
में और मेरा भाई वहा कल जाएंगे,मैं और मेरा भाई वहाँ कल जाएंगे।
हमे सुख दुख में साथ रहना चाहिए,हमें सुख-दुख में साथ रहना चाहिए।
जीवन में सुख और दुख आते रहते हैं,जीवन में सुख और दुख आते रहते हैं।
वो धीरे धीरे चल रहा था,वह धीरे-धीरे चल रहा था।
माँ ने कहा कि धीरे और प्यार से बोलो,माँ ने कहा कि धीरे और प्यार से बोलो।
हमे अपनी हार जीत स्वीकार करनी चाहिए,हमें अपनी हार-जीत स्वीकार करनी चाहिए।
ये खेल में हार और जीत का सवाल है,यह खेल में हार और जीत का सवाल है।
वो बार बार वही बात दोहरा रहा है,वह बार-बार वही बात दोहरा रहा है।
रात और दिन काम करना पड़ता है,रात और दिन काम करना पड़ता है।
दिन रात एक कर दो सफलता मिलेगी,"दिन-रात एक कर दो, सफलता मिलेगी।"
कभी कभी में सोचता हु,कभी-कभी मैं सोचता हूँ।
कभी और कही भी मिल सकते हैं,कभी और कहीं भी मिल सकते हैं।
हमे सही गलत का पता होना चाहिए,हमें सही-गलत का पता होना चाहिए।
सही और गलत के बीच फर्क समझो,सही और गलत के बीच फर्क समझो।
आना जाना लगा रहता है,आना-जाना लगा रहता है।
यहाँ से आना और जाना मना है,यहाँ से आना और जाना मना है।
आज सुबह जब में उठा तो माँ ने कहा कि बाहर मत जाओ क्योंकि धूप बहुत है मुझे दुकान जाना था ताकि में कुछ सामान ला सकूँ अब में थक गया हूँ और धीरे धीरे घर वापस आ रहा हूँ,आज सुबह जब मैं उठा तो माँ ने कहा कि बाहर मत जाओ क्योंकि धूप बहुत है। मुझे दुकान जाना था ताकि मैं कुछ सामान ला सकूँ। अब मैं थक गया हूँ और धीरे-धीरे घर वापस आ रहा हूँ।
कल रात बहुत तेज बारिश हो रही थी और बिजली भी कड़क रही थी में खिड़की के पास बैठा था और सोच रहा था कि कल दफ्तर कैसे जाऊंगा सुबह होते ही धूप निकल आई और मौसम साफ हो गया,कल रात बहुत तेज बारिश हो रही थी और बिजली भी कड़क रही थी। मैं खिड़की के पास बैठा था और सोच रहा था कि कल दफ्तर कैसे जाऊँगा? सुबह होते ही धूप निकल आई और मौसम साफ हो गया।
क्या तुम मेरे साथ चलोगे मुझे बाज़ार से कुछ ज़रूरी सामान लेना है और माँ ने कहा है कि अकेले मत जाना रास्ता बहुत खराब है और भीड़ भी ज्यादा होगी,क्या तुम मेरे साथ चलोगे? मुझे बाज़ार से कुछ ज़रूरी सामान लेना है और माँ ने कहा है कि अकेले मत जाना। रास्ता बहुत खराब है और भीड़ भी ज्यादा होगी।
भाई आजकल तुम कहा रहते हो माँ पूछ रही थी कि क्या तुम ठीक हो और अगर तुम्हे पैसों की ज़रूरत हो तो बता देना में कल जब शहर आऊंगा तब हम मिलेंगे,"भाई! आजकल तुम कहाँ रहते हो? माँ पूछ रही थी कि क्या तुम ठीक हो और अगर तुम्हें पैसों की ज़रूरत हो तो बता देना। मैं कल जब शहर आऊँगा, तब हम मिलेंगे।"
में कल गाँव गया था वहा सब बहुत खुश थे और गाव की ताजी हवा और हरियाली देखकर मन प्रसन्न हो गया अब में वापस शहर आ गया हु पर मन वही लगा है,"मैं कल गाँव गया था। वहाँ सब बहुत खुश थे और गाँव की ताजी हवा और हरियाली देखकर मन प्रसन्न हो गया। अब मैं वापस शहर आ गया हूँ, पर मन वहीं लगा है।"
जल्दी करो ट्रेन छूट जाएगी फिर हम क्या करेंगे वहा पहुँचने में वैसे ही बहुत देर हो चुकी है और हमे समय पर प्रोग्राम में पहुचना है,"जल्दी करो! ट्रेन छूट जाएगी, फिर हम क्या करेंगे? वहाँ पहुँचने में वैसे ही बहुत देर हो चुकी है और हमें समय पर प्रोग्राम में पहुँचना है।"
में जानता हु कि तुम वहा नहीं जाना चाहते पर मा के लिए तुम्हे चलना पड़ेगा उन्होंने तुम्हे बहुत याद किया है और वो तुम्हारे लिए खाना बना रही हैं,"मैं जानता हूँ कि तुम वहाँ नहीं जाना चाहते, पर माँ के लिए तुम्हें चलना पड़ेगा। उन्होंने तुम्हें बहुत याद किया है और वह तुम्हारे लिए खाना बना रही हैं।"
में कल गाँव जाऊंगा मा वहा इंतज़ार कर रही होगी,मैं कल गाँव जाऊँगा। माँ वहाँ इंतज़ार कर रही होगी।
क्या तुम जानते हो कि वहा क्या हुआ में तो डर गया था,क्या तुम जानते हो कि वहाँ क्या हुआ? मैं तो डर गया था।
हमे सुख दुख और हार जीत को समान समझना चाहिए,हमें सुख-दुख और हार-जीत को समान समझना चाहिए।
मा ने पूछा कि क्या तुम मेरे साथ चलोगे में बाजार जा रही हु,माँ ने पूछा कि क्या तुम मेरे साथ चलोगे? मैं बाज़ार जा रही हूँ।
वहा कौन खड़ा है क्या तुम उसे जानते हो,वहाँ कौन खड़ा है? क्या तुम उसे जानते हो?
में धीरे धीरे चल रहा हु ताकि मा को पता न चले,"मैं धीरे-धीरे चल रहा हूँ, ताकि माँ को पता न चले।"
क्या तुमने खाना खाया है मा ने तुम्हारे लिए बनाया है,क्या तुमने खाना खाया है? माँ ने तुम्हारे लिए बनाया है।
में वहा जाऊंगा जहा मा ने जाने को कहा है,मैं वहाँ जाऊँगा जहाँ माँ ने जाने को कहा है।
रात दिन काम करने से ही सफलता मिलेगी क्या तुम तैयार हो,रात-दिन काम करने से ही सफलता मिलेगी। क्या तुम तैयार हो?
में जानता हु कि तुम नहीं जाना चाहते पर मा के लिए चलो,"मैं जानता हूँ कि तुम नहीं जाना चाहते, पर माँ के लिए चलो।"
क्या तुम मेरे साथ चलोगे मुझे वहा कुछ काम है,क्या तुम मेरे साथ चलोगे? मुझे वहाँ कुछ काम है।
में और मा कल शहर जाएंगे जहा बहुत भीड़ होगी,"मैं और माँ कल शहर जाएंगे, जहाँ बहुत भीड़ होगी।"
कहा लिखा है कि मा घर पर नहीं है क्या तुमने देखा,कहाँ लिखा है कि माँ घर पर नहीं है? क्या तुमने देखा?
में थक गया हु और अब में बस सोना चाहता हु,मैं थक गया हूँ और अब मैं बस सोना चाहता हूँ।
क्या तुम आओगे रास्ता साफ़ है और मा भी बुला रही है,क्या तुम आओगे? रास्ता साफ़ है और माँ भी बुला रही है।
में गाव जाउगा मा वहा अकेली है,मैं गाँव जाऊँगा। माँ वहाँ अकेली हैं।
कहा जा रहे हो जहा पानी भरा है,कहाँ जा रहे हो जहाँ पानी भरा है?
में जानता हु कि तुम वहा हो,मैं जानता हूँ कि तुम वहाँ हो।
मा ने कहा कि जहा धूप हो वहा मत बैठो,माँ ने कहा कि जहाँ धूप हो वहाँ मत बैठो।
में कल शहर जाउगा जहा बहुत काम है,"मैं कल शहर जाऊँगा, जहाँ बहुत काम है।"
क्या तुम जानते हो रास्ता कहा जाता है,क्या तुम जानते हो? रास्ता कहाँ जाता है।
भाई कहा जा रहे हो मा बुला रही है,भाई! कहाँ जा रहे हो? माँ बुला रही हैं।
क्या आप जानते है कल दफ्तर बंद है,क्या आप जानते हैं? कल दफ्तर बंद है।
में वहा जाउगा क्या तुम भी आओगे,मैं वहाँ जाऊँगा। क्या तुम भी आओगे?
क्या तुमने देखा मा रसोई में है,क्या तुमने देखा? माँ रसोई में हैं।
जीवन में सुख दुख तो लगा रहता है,जीवन में सुख-दुख तो लगा रहता है।
हमे सुख और दुख दोनों में धीरज रखना चाहिए,हमें सुख और दुख दोनों में धीरज रखना चाहिए।
यहा से आना जाना बहुत मुश्किल है,यहाँ से आना-जाना बहुत मुश्किल है।
यहा रोज आना और जाना पड़ता है,यहाँ रोज आना और जाना पड़ता है।
कभी कभी में सोचता हु कि सही गलत क्या है,कभी-कभी मैं सोचता हूँ कि सही-गलत क्या है।
सही और गलत के बीच की रेखा बहुत पतली है,सही और गलत के बीच की रेखा बहुत पतली है।
में कल बाज़ार गया था जहा बहुत भीड़ थी क्या तुम जानते हो वहा क्या हुआ में अपनी मा के साथ खड़ा था और अचानक एक आदमी आया और पूछने लगा कि रास्ता कहा जाता है में चुप रहा क्योंकि मा ने कहा था अनजानों से बात मत करो,मैं कल बाज़ार गया था जहाँ बहुत भीड़ थी। क्या तुम जानते हो वहाँ क्या हुआ? मैं अपनी माँ के साथ खड़ा था और अचानक एक आदमी आया और पूछने लगा कि रास्ता कहाँ जाता है। मैं चुप रहा क्योंकि माँ ने कहा था अनजानों से बात मत करो।
कल रात बहुत तेज बारिश हो रही थी और में खिड़की के पास बैठा था में सोच रहा था कि सही गलत का फैसला कैसे होता है जीवन में सुख दुख आते रहते है पर हमे हर बार बार वही गलती नहीं करनी चाहिए क्या तुम मेरी बात समझ रहे हो,"कल रात बहुत तेज बारिश हो रही थी और मैं खिड़की के पास बैठा था। मैं सोच रहा था कि सही-गलत का फैसला कैसे होता है? जीवन में सुख-दुख आते रहते हैं, पर हमें बार-बार वही गलती नहीं करनी चाहिए। क्या तुम मेरी बात समझ रहे हो?"
मा ने कहा कि जल्दी घर आना क्योंकि मेहमान आने वाले है मुझे बाज़ार में देर हो गई जहा बहुत भीड़ थी अब में सोच रहा हु कि मा को क्या जवाब दूंगा क्या तुम मेरे साथ चलकर सफाई दोगे,माँ ने कहा कि जल्दी घर आना क्योंकि मेहमान आने वाले हैं। मुझे बाज़ार में देर हो गई जहाँ बहुत भीड़ थी। अब मैं सोच रहा हूँ कि माँ को क्या जवाब दूँगा? क्या तुम मेरे साथ चलकर सफाई दोगे?
आज सुबह जब में उठा तो मौसम बहुत अच्छा था ठंडी हवा चल रही थी और में बगीचे में बैठा था वहा बहुत शांति थी पर अचानक शोर होने लगा और मेरा ध्यान टूट गया क्या तुम जानते हो वहा क्या हुआ था,"आज सुबह जब मैं उठा तो मौसम बहुत अच्छा था। ठंडी हवा चल रही थी और मैं बगीचे में बैठा था। वहाँ बहुत शांति थी, पर अचानक शोर होने लगा और मेरा ध्यान टूट गया। क्या तुम जानते हो वहाँ क्या हुआ था?"
भाई आजकल तुम कहा रहते हो मा पूछ रही थी कि क्या तुम ठीक हो अगर तुम्हे पैसो की ज़रूरत हो तो बता देना में कल शहर आउगा तब हम मिलेंगे और ढेर सारी बाते करेंगे,"भाई! आजकल तुम कहाँ रहते हो? माँ पूछ रही थी कि क्या तुम ठीक हो? अगर तुम्हें पैसों की ज़रूरत हो तो बता देना। मैं कल शहर जाऊँगा, तब हम मिलेंगे और ढेर सारी बातें करेंगे।"
क्या तुम जानते हो में कल कहा था मा को बहुत चिंता हो रही थी,क्या तुम जानते हो मैं कल कहाँ था? माँ को बहुत चिंता हो रही थी।
भाई क्या तुम मेरे साथ चलोगे मुझे बाज़ार से सामान लाना है,भाई! क्या तुम मेरे साथ चलोगे? मुझे बाज़ार से सामान लाना है।
में कल गाँव जाऊंगा क्या तुम भी वहा आओगे मा ने पूछा है,मैं कल गाँव जाऊँगा। क्या तुम भी वहाँ आओगे? माँ ने पूछा है।
सुख दुख तो जीवन का हिस्सा है पर हमे घबराना नहीं चाहिए,"सुख-दुख तो जीवन का हिस्सा हैं, पर हमें घबराना नहीं चाहिए।"
जीवन में सुख और दुख दोनों का अपना महत्व है,जीवन में सुख और दुख दोनों का अपना महत्व है।
क्या आप जानते है कि में कहा हु रास्ता बहुत सुनसान है,क्या आप जानते हैं कि मैं कहाँ हूँ? रास्ता बहुत सुनसान है।
में धीरे धीरे चल रहा हु ताकि कोई मुझे देख न ले,"मैं धीरे-धीरे चल रहा हूँ, ताकि कोई मुझे देख न ले।"
