Noisy,Clean
देखो वहा क्या पडा है क्या तुम उसे उठाओगे,"देखो, वहाँ क्या पड़ा है। क्या तुम उसे उठाओगे?"
क्या तुमने मा से बात की वो नाराज है,क्या तुमने माँ से बात की? वह नाराज़ हैं।
भाई रुको क्या तुमने देखा,"भाई, रुको! क्या तुमने देखा?"
क्या तुम जानते हो कि कल क्या हुआ,क्या तुम जानते हो कि कल क्या हुआ?
देखो वहा कोई चिल्ला रहा है क्या सब ठीक है,"देखो, वहाँ कोई चिल्ला रहा है। क्या सब ठीक है?"
क्या तुमने खाना बनाया मा भूखी है,क्या तुमने खाना बनाया? माँ भूखी हैं।
भाई सुनो क्या तुम मेरे साथ चलोगे,"भाई, सुनो! क्या तुम मेरे साथ चलोगे?"
क्या आप जानते है कि रास्ता कहा जाता है,क्या आप जानते हैं कि रास्ता कहाँ जाता है?
देखो वहा बहुत भीड है क्या तुम वहा जाओगे,"देखो, वहाँ बहुत भीड़ है। क्या तुम वहाँ जाओगे?"
क्या तुमने सुना वो क्या कह रहा था,क्या तुमने सुना वह क्या कह रहा था?
भाई साहब क्या आप बता सकते है ये घर किसका है,"भाई साहब, क्या आप बता सकते हैं ये घर किसका है?"
क्या तुम जानते हो कि में कहा हु,क्या तुम जानते हो कि मैं कहाँ हूँ?
देखो वहा बारिश हो रही है क्या तुम छाता लोगे,"देखो, वहाँ बारिश हो रही है। क्या तुम छाता लोगे?"
क्या तुमने दरवाजा खोला मा बाहर खडी है,क्या तुमने दरवाजा खोला? माँ बाहर खड़ी हैं।
भाई सुनो क्या तुम कल बाजार जाओगे,"भाई, सुनो! क्या तुम कल बाज़ार जाओगे?"
क्या आप जानते है कि में कौन हु,क्या आप जानते हैं कि मैं कौन हूँ?
देखो वहा कोई है क्या तुम देख सकते हो,"देखो, वहाँ कोई है। क्या तुम देख सकते हो?"
क्या तुमने उसे देखा वो अभी वहा था,क्या तुमने उसे देखा? वह अभी वहाँ था।
भाई रुको क्या तुम मेरे साथ आओगे,"भाई, रुको! क्या तुम मेरे साथ आओगे?"
क्या तुम जानते हो कि रास्ता कहा बंद है,क्या तुम जानते हो कि रास्ता कहाँ बंद है?
देखो वha क्या गिरा क्या तुमने देखा,"देखो, वहाँ क्या गिरा? क्या तुमने देखा?"
क्या तुमने खाना खाया मा इंतज़ार कर रही है,क्या तुमने खाना खाया? माँ इंतज़ार कर रही हैं।
भाई साहब क्या आप जानते है स्टेशन कहा है,"भाई साहब, क्या आप जानते हैं स्टेशन कहाँ है?"
क्या तुम्हे पता है कि में कहा जा रहा हु,क्या तुम्हें पता है कि मैं कहाँ जा रहा हूँ?
देखो वहा बादल है क्या बारिश होगी,"देखो, वहाँ बादल हैं। क्या बारिश होगी?"
क्या तुमने मा से पूछा कि वो कहा है,क्या तुमने माँ से पूछा कि वह कहाँ हैं?
भाई रुको क्या तुम मेरे साथ उधर चलोगे,"भाई, रुको! क्या तुम मेरे साथ उधर चलोगे?"
क्या आप जानते है कि कल क्या होगा,क्या आप जानते हैं कि कल क्या होगा?
हमे सुख दुख और हार जीत को एक समान समझना चाहिए,हमें सुख-दुख और हार-जीत को एक समान समझना चाहिए।
जीवन में सुख और दुख का आना जाना लगा ही रहता है,जीवन में सुख और दुख का आना-जाना लगा ही रहता है।
माँ ने कहा कि सही गलत और हार जीत तो जीवन के हिस्से हैं,माँ ने कहा कि सही-गलत और हार-जीत तो जीवन के हिस्से हैं।
हमे सही और गलत के बीच का फर्क समझकर आगे बढ़ना चाहिए,हमें सही और गलत के बीच का फर्क समझकर आगे बढ़ना चाहिए।
रात दिन काम करने से ही सुख और शांति मिलेगी,दिन-रात काम करने से ही सुख और शांति मिलेगी।
माता पिता की सेवा करना और उनका आदर करना हमारा कर्तव्य है,माता-पिता की सेवा करना और उनका आदर करना हमारा कर्तव्य है।
भाई बहन का प्यार और उनका मेल जोल हमेशा बना रहे,भाई-बहन का प्यार और उनका मेल-जोल हमेशा बना रहे।
वो बार बार वही बात दोहराता है और सबको परेशान करता है,वह बार-बार वही बात दोहराता है और सबको परेशान करता है।
कभी कभी में सोचता हूँ कि कल और आज में क्या फर्क है,कभी-कभी मैं सोचता हूँ कि कल और आज में क्या फर्क है।
यहाँ आना जाना मना है और शोर करना भी वर्जित है,यहाँ आना-जाना मना है और शोर करना भी वर्जित है।
हमे उठते बैठते और चलते फिरते भगवान का नाम लेना चाहिए,हमें उठते-बैठते और चलते-फिरते भगवान का नाम लेना चाहिए।
खाना पीना और सोना जागना समय पर होना चाहिए,खाना-पीना और सोना-जागना समय पर होना चाहिए।
चाय पानी का इंतजाम करो और मेहमानों का स्वागत करो,चाय-पानी का इंतजाम करो और मेहमानों का स्वागत करो।
खेल कूद में हिस्सा लो और अपनी सेहत का ध्यान रखो,खेल-कूद में हिस्सा लो और अपनी सेहत का ध्यान रखो।
सुख और दुख तो धूप छाँव की तरह आते जाते रहते हैं,सुख और दुख तो धूप-छाँव की तरह आते-जाते रहते हैं।
थोडा बहुत काम करो और बाकी समय आराम करो,थोड़ा-बहुत काम करो और बाकी समय आराम करो।
इधर उधर मत देखो और सीधे रास्ते पर चलो,इधर-उधर मत देखो और सीधे रास्ते पर चलो।
आस पास सफाई रखो और कचरा यहाँ वहाँ मत फेंको,आस-पास सफाई रखो और कचरा यहाँ-वहाँ मत फेंको।
दाल रोटी खाओ और प्रभु के गुण गाओ,दाल-रोटी खाओ और प्रभु के गुण गाओ।
अपना भला बुरा सोचो और फिर कोई फैसला लो,अपना भला-बुरा सोचो और फिर कोई फैसला लो।
जान पहचान के लोग और रिश्तेदार सब आए थे,जान-पहचान के लोग और रिश्तेदार सब आए थे।
कामकाज में मन लगाओ और आलस को दूर भगाओ,काम-काज में मन लगाओ और आलस को दूर भगाओ।
मेल मिलाप बढ़ाओ और नफरत को खत्म करो,मेल-मिलाप बढ़ाओ और नफरत को खत्म करो।
सोच विचार कर बोलो और कड़वा सच मत कहो,सोच-विचार कर बोलो और कड़वा सच मत कहो।
हँसी मज़ाक करो और खुशियाँ बाँटो,हँसी-मज़ाक करो और खुशियाँ बाँटो।
लेन देन का हिसाब रखो और ईमानदारी से काम करो,लेन-देन का हिसाब रखो और ईमानदारी से काम करो।
जीत हार तो खेल का हिस्सा है और इसे स्वीकार करो,जीत-हार तो खेल का हिस्सा है और इसे स्वीकार करो।
सुबह शाम टहलना और योग करना अच्छा होता है,सुबह-शाम टहलना और योग करना अच्छा होता है।
देश विदेश की खबरें और नई जानकारी हासिल करो,देश-विदेश की खबरें और नई जानकारी हासिल करो।
ऊँच नीच का भेद मिटाओ और सबको गले लगाओ,ऊँच-नीच का भेद मिटाओ और सबको गले लगाओ।
छोटा बड़ा कोई नहीं होता और सब बराबर हैं,छोटा-बड़ा कोई नहीं होता और सब बराबर हैं।
जात पाँत के झगड़े और भेदभाव खत्म होने चाहिए,जात-पाँत के झगड़े और भेदभाव खत्म होने चाहिए।
पाप पुण्य का विचार करो और नेक काम करो,पाप-पुण्य का विचार करो और नेक काम करो।
अड़ोस पड़ोस के लोग और मित्र सब मदद करते हैं,अड़ोस-पड़ोस के लोग और मित्र सब मदद करते हैं।
कूड़ा कचरा साफ़ करो और हरियाली बढ़ाओ,कूड़ा-कचरा साफ़ करो और हरियाली बढ़ाओ।
घर बार छोड़ना और सन्यास लेना आसान नहीं है,घर-बार छोड़ना और सन्यास लेना आसान नहीं है।
धन दौलत के पीछे मत भागो और शांति से जियो,धन-दौलत के पीछे मत भागो और शांति से जियो।
मार पीट करना और गाली देना बुरी बात है,मार-पीट करना और गाली देना बुरी बात है।
फल फूल और सब्जियाँ ताजी खानी चाहिए,फल-फूल और सब्जियाँ ताजी खानी चाहिए।
नदी नाले और तालाब सब भर गए हैं,नदी-नाले और तालाब सब भर गए हैं।
खेती बाड़ी करना और अनाज उगाना मेहनत का काम है,खेती-बाड़ी करना और अनाज उगाना मेहनत का काम है।
पशु पक्षी और जानवर भी प्रेम के भूखे होते हैं,पशु-पक्षी और जानवर भी प्रेम के भूखे होते हैं।
जीव जंतु और इंसान सबका भला सोचो,जीव-जंतु और इंसान सबका भला सोचो।
सीधा साधा जीवन और ऊँचे विचार रखो,सीधा-साधा जीवन और ऊँचे विचार रखो।
नया पुराना सामान और कपड़े दान कर दो,नया-पुराना सामान और कपड़े दान कर दो।
काला सफेद का भेद और रंगों का मेल देखो,काला-सफेद का भेद और रंगों का मेल देखो।
अमीर गरीब और छोटे बड़े सब एक समान हैं,अमीर-गरीब और छोटे-बड़े सब एक समान हैं।
पढ़ना लिखना और सीखना कभी बंद मत करो,पढ़ना-लिखना और सीखना कभी बंद मत करो।
लड़ाई झगड़ा छोड़ो और शांति से बात करो,लड़ाई-झगड़ा छोड़ो और शांति से बात करो।
टाल मटोल करना और बहाने बनाना छोड़ दो,टाल-मटोल करना और बहाने बनाना छोड़ दो।
चमक धमक वाली दुनिया और इसकी चकाचौंध से बचो,चमक-धमक वाली दुनिया और इसकी चकाचौंध से बचो।
भाग दौड़ भरी जिंदगी और तनाव से दूर रहो,भाग-दौड़ भरी जिंदगी और तनाव से दूर रहो।
साफ़ सुथरा घर और मन दोनों अच्छे होते हैं,साफ़-सुथरा घर और मन दोनों अच्छे होते हैं।
उलटा सीधा मत बोलो और मर्यादा में रहो,उलटा-सीधा मत बोलो और मर्यादा में रहो।
टेढ़ा मेढ़ा रास्ता और ऊँची चढ़ाई मुश्किल है,टेढ़ा-मेढ़ा रास्ता और ऊँची चढ़ाई मुश्किल है।
अकल मंदी दिखाओ और बेवकूफी मत करो,अकल-मंदी दिखाओ और बेवकूफी मत करो।
भीड़ भाड़ वाली जगह और शोर से बचो,भीड़-भाड़ वाली जगह और शोर से बचो।
सगे संबंधी और मित्र सब समारोह में आए थे,सगे-संबंधी और मित्र सब समारोह में आए थे।
रोजी रोटी कमाना और परिवार पालना कठिन है,रोजी-रोटी कमाना और परिवार पालना कठिन है।
बाल बच्चे और परिवार का ध्यान रखना चाहिए,बाल-बच्चे और परिवार का ध्यान रखना चाहिए।
रंग रूप और वेशभूषा बदल सकती है पर मन नहीं,रंग-रूप और वेशभूषा बदल सकती है पर मन नहीं।
बोल चाल का तरीका और शिष्टाचार बहुत ज़रूरी है,बोल-चाल का तरीका और शिष्टाचार बहुत ज़रूरी है।
तोड़ फोड़ करना और संपत्ति को नुकसान पहुँचाना गलत है,तोड़-फोड़ करना और संपत्ति को नुकसान पहुँचाना गलत है।
लूट पाट और चोरी की घटनाएँ बढ़ गई हैं,लूट-पाट और चोरी की घटनाएँ बढ़ गई हैं।
रोक टोक करना और सवाल पूछना अच्छी बात नहीं,रोक-टोक करना और सवाल पूछना अच्छी बात नहीं।
उलट फेर होना और बदलाव आना कुदरत का नियम है,उलट-फेर होना और बदलाव आना कुदरत का नियम है।
बढ़ा चढ़ाकर बोलना और झूठ फैलाना बंद करो,बढ़ा-चढ़ाकर बोलना और झूठ फैलाना बंद करो।
सजी धजी दुकान और ग्राहकों की भीड़ देखो,सजी-धजी दुकान और ग्राहकों की भीड़ देखो।
पढ़ा लिखा इंसान और समझदार व्यक्ति सम्मान पाता है,पढ़ा-लिखा इंसान और समझदार व्यक्ति सम्मान पाता है।
सुना सुनाया किस्सा और पुरानी बातें याद आईं,सुना-सुनाया किस्सा और पुरानी बातें याद आईं।
रुखा सूखा खाना और संतोष करना सीखो,रुखा-सूखा खाना और संतोष करना सीखो।
खट्टा मीठा फल और स्वादिष्ट व्यंजन खाओ,खट्टा-मीठा फल और स्वादिष्ट व्यंजन खाओ।
कड़वा मीठा अनुभव और जीवन की सीख याद रखो,कड़वा-मीठा अनुभव और जीवन की सीख याद रखो।
तीखा चटपटा खाना और मसालेदार चीज़ें कम खाओ,तीखा-चटपटा खाना और मसालेदार चीज़ें कम खाओ।
गहरा हल्का रंग और कपड़ों का चुनाव करो,गहरा-हल्का रंग और कपड़ों का चुनाव करो।
मोटा पतला होना और सेहत का ध्यान रखना ज़रूरी है,मोटा-पतला होना और सेहत का ध्यान रखना ज़रूरी है।
लंबा चौड़ा भाषण और बोरियत वाली बातें मत करो,लंबा-चौड़ा भाषण और बोरियत वाली बातें मत करो।
भारी भरकम बोझ और जिम्मेदारी उठाना सीखो,भारी-भरकम बोझ और जिम्मेदारी उठाना सीखो।
कच्चा पक्का मकान और गाँव की यादें ताज़ा करो,कच्चा-पक्का मकान और गाँव की यादें ताज़ा करो।
ऊँचा नीचा रास्ता और पहाड़ों की सैर करो,ऊँचा-नीचा रास्ता और पहाड़ों की सैर करो।
गीला सूखा कचरा और सफाई का ध्यान रखो,गीला-सूखा कचरा और सफाई का ध्यान रखो।
ठंडा गरम पानी और मौसम का मिजाज देखो,ठंडा-गरम पानी और मौसम का मिजाज देखो।
नरम सख्त व्यवहार और अनुशासन ज़रूरी है,नरम-सख्त व्यवहार और अनुशासन ज़रूरी है।
ताजा बासी खाना और सेहत का ख्याल रखो,ताजा-बासी खाना और सेहत का ख्याल रखो।
हल्का भारी सामान और उठाने की ताकत देखो,हल्का-भारी सामान और उठाने की ताकत देखो।
कम ज्यादा पैसे और बचत करना सीखो,कम-ज्यादा पैसे और बचत करना सीखो।
सस्ता महँगा सामान और बाजार का भाव देखो,सस्ता-महँगा सामान और बाजार का भाव देखो।
जल्दी जल्दी काम खत्म करो और घर चलो,जल्दी-जल्दी काम खत्म करो और घर चलो।
धीरे धीरे आगे बढ़ो और अपनी मंजिल पाओ,धीरे-धीरे आगे बढ़ो और अपनी मंजिल पाओ।
बार बार कोशिश करो और हार मत मानो,बार-बार कोशिश करो और हार मत मानो।
कभी कभी बाहर घूमो और ताजी हवा लो,कभी-कभी बाहर घूमो और ताजी हवा लो।
यहाँ वहाँ मत भटको और काम पर ध्यान दो,यहाँ-वहाँ मत भटको और काम पर ध्यान दो।
आस पास सफाई रखो और बीमारियाँ दूर भगाओ,आस-पास सफाई रखो और बीमारियाँ दूर भगाओ।
आमने सामने बैठकर बात करो और गलतफहमी दूर करो,आमने-सामने बैठकर बात करो और गलतफहमी दूर करो।
हाथ पैर धो लो और खाना खाओ,हाथ-पैर धो लो और खाना खाओ।
आँख कान खुले रखो और सतर्क रहो,आँख-कान खुले रखो और सतर्क रहो।
तन मन से सेवा करो और नेक इंसान बनो,तन-मन से सेवा करो और नेक इंसान बनो।
जन मन की बात सुनो और लोकतंत्र का आदर करो,जन-मन की बात सुनो और लोकतंत्र का आदर करो।
