Noisy,Clean
में जानता हु कि तुम कहा हो भाई क्या तुम बाहर आओगे या में अंदर आउ मा कब से तुम्हारा इंतजार कर रही है और खाना भी तैयार है क्या तुम अभी भी नाराज हो,"मैं जानता हूँ कि तुम कहाँ हो, भाई। क्या तुम बाहर आओगे या मैं अंदर आऊँ? माँ कब से तुम्हारा इंतज़ार कर रही हैं और खाना भी तैयार है। क्या तुम अभी भी नाराज़ हो?"
मा बहुत प्यारी है में उनसे बहुत प्यार करता हु और उनकी बाते मानता हु क्या तुम भी ऐसा करते हो वो हमेशा हमारा भला सोचती है और हमे सही रास्ता दिखाती है हमे उनका आदर करना चाहिए,माँ बहुत प्यारी हैं। मैं उनसे बहुत प्यार करता हूँ और उनकी बातें मानता हूँ। क्या तुम भी ऐसा करते हो? वह हमेशा हमारा भला सोचती हैं और हमें सही रास्ता दिखाती हैं। हमें उनका आदर करना चाहिए।
जहा रास्ता सही हो वहा चलना चाहिए क्या तुम मेरी सलाह मानोगे या अपनी मर्जी करोगे गलत रास्ते पर चलने से सिर्फ परेशानी होती है और समय भी बर्बाद होता है क्या तुम मेरी बात समझ रहे हो,जहाँ रास्ता सही हो वहाँ चलना चाहिए। क्या तुम मेरी सलाह मानोगे या अपनी मर्जी करोगे? गलत रास्ते पर चलने से सिर्फ परेशानी होती है और समय भी बर्बाद होता है। क्या तुम मेरी बात समझ रहे हो?
में कल काम पर जाउगा जहा बहुत भीड है क्या तुम मुझे वहा छोड दोगे या में बस से जाउ वहा पार्किंग की बहुत समस्या है और में लेट नहीं होना चाहता क्या तुम सुबह जल्दी उठ सकते हो,मैं कल काम पर जाऊँगा जहाँ बहुत भीड़ है। क्या तुम मुझे वहाँ छोड़ दोगे या मैं बस से जाऊँ? वहाँ पार्किंग की बहुत समस्या है और मैं लेट नहीं होना चाहता। क्या तुम सुबह जल्दी उठ सकते हो?
कहा रखा है मेरा बैग जहा में देख सकू क्या तुमने उसे छुआ है या वो खुद गायब हो गया में उसे सुबह से ढूढ रहा हु और अब मुझे दफ्तर के लिए देर हो रही है क्या तुमने अलमारी में देखा,कहाँ रखा है मेरा बैग जहाँ मैं देख सकूँ? क्या तुमने उसे छुआ है या वह खुद गायब हो गया? मैं उसे सुबह से ढूँढ रहा हूँ और अब मुझे दफ्तर के लिए देर हो रही है। क्या तुमने अलमारी में देखा?
में जानता हु कि मा कहा खडी है क्या तुम वहा जाओगे या यही मेरा इंतज़ार करोगे वो मंदिर के पास वाले मोड पर है और उनके पास बहुत सारा सामान है क्या तुम उनकी मदद करोगे,मैं जानता हूँ कि माँ कहाँ खड़ी हैं। क्या तुम वहाँ जाओगे या यहीं मेरा इंतज़ार करोगे? वह मंदिर के पास वाले मोड़ पर हैं और उनके पास बहुत सारा सामान है। क्या तुम उनकी मदद करोगे?
गाव जाने का रास्ता कहा से है क्या कोई मुझे बता सकता है में रास्ता भटक गया हु और मेरा फोन भी स्विच ऑफ होने वाला है क्या यहा कोई पेट्रोल पंप है जहा में पूछ सकू में बहुत परेशान हु,गाँव जाने का रास्ता कहाँ से है? क्या कोई मुझे बता सकता है? मैं रास्ता भटक गया हूँ और मेरा फोन भी स्विच ऑफ होने वाला है। क्या यहाँ कोई पेट्रोल पंप है जहाँ मैं पूछ सकूँ? मैं बहुत परेशान हूँ।
में वहा कल जाउगा जहा मेला लगा है क्या तुम भी साथ चलोगे या तुम्हे भीड पसंद नहीं मा ने कहा था कि मेले में बहुत रौनक होती है और वहा खाने पीने का सामान भी बहुत अच्छा मिलता है क्या तुम तैयार हो,मैं वहाँ कल जाऊँगा जहाँ मेला लगा है। क्या तुम भी साथ चलोगे या तुम्हें भीड़ पसंद नहीं? माँ ने कहा था कि मेले में बहुत रौनक होती है और वहाँ खाने-पीने का सामान भी बहुत अच्छा मिलता है। क्या तुम तैयार हो?
मा ने कहा कि में वहा नहीं जाउगा क्या तुमने सुना उन्होंने क्या कहा अब में क्या करू में तो वहा जाने के लिए बहुत उत्साहित था पर मा की बात टालना भी सही नहीं है क्या तुम उन्हें मनाओगे,"माँ ने कहा कि मैं वहाँ नहीं जाऊँगा। क्या तुमने सुना उन्होंने क्या कहा? अब मैं क्या करूँ? मैं तो वहाँ जाने के लिए बहुत उत्साहित था, पर माँ की बात टालना भी सही नहीं है। क्या तुम उन्हें मनाओगे?"
जहा भी हो मा को फोन कर देना क्या तुम भूल तो नहीं जाओगे मा बहुत परेशान है और वो बार बार तुम्हारा पूछ रही है उन्हें तुम्हारी बहुत चिंता रहती है इसलिए जल्दी बात कर लो,"जहाँ भी हो माँ को फोन कर देना। क्या तुम भूल तो नहीं जाओगे? माँ बहुत परेशान हैं और वह बार-बार तुम्हारा पूछ रही हैं। उन्हें तुम्हारी बहुत चिंता रहती है, इसलिए जल्दी बात कर लो।"
में कल आउगा क्या तुम वहा मिलोगे मा ने तुम्हे बुलाया है और वो बहुत खुश है उन्होंने तुम्हारे लिए कुछ खास तोहफा भी रखा है क्या तुम कल सुबह जल्दी आ सकते हो ताकि हम साथ समय बिता सके,मैं कल जाऊँगा। क्या तुम वहाँ मिलोगे? माँ ने तुम्हें बुलाया है और वह बहुत खुश हैं। उन्होंने तुम्हारे लिए कुछ खास तोहफा भी रखा है। क्या तुम कल सुबह जल्दी आ सकते हो ताकि हम साथ समय बिता सकें?
कहा मिलेगी शांति जहा में जा सकू क्या तुम मेरा साथ दोगे या में अकेला ही जाउ में शहर के शोर शराबे से थक गया हु और अब गाव की हरियाली में रहना चाहता हु क्या तुम्हे भी वहा चलना है,कहाँ मिलेगी शांति जहाँ मैं जा सकूँ? क्या तुम मेरा साथ दोगे या मैं अकेला ही जाऊँ? मैं शहर के शोर-शराबे से थक गया हूँ और अब गाँव की हरियाली में रहना चाहता हूँ। क्या तुम्हें भी वहाँ चलना है?
में कल बाजार जाउगा जहा बहुत भीड है क्या तुम कुछ मगाओगे या खुद चलोगे मुझे वहा से कुछ जारूरी सामान और कपडे खरीदने है मा ने भी कुछ चीजे लाने को कहा है क्या तुम फ्री हो,मैं कल बाज़ार जाऊँगा जहाँ बहुत भीड़ है। क्या तुम कुछ मँगाओगे या खुद चलोगे? मुझे वहाँ से कुछ ज़रूरी सामान और कपड़े खरीदने हैं। माँ ने भी कुछ चीज़ें लाने को कहा है। क्या तुम फ्री हो?
मा ने कहा कि में वहा खडा रहू क्या तुम मेरे पास आओगे या में वहा आउ यहा धूप बहुत तेज है और में छांव ढूढ रहा हु क्या तुम्हारे पास छाता है जो तुम ला सको में तुम्हारा इंतजार कर रहा हु,माँ ने कहा कि मैं वहाँ खड़ा रहूँ। क्या तुम मेरे पास आओगे या मैं वहाँ आऊँ? यहाँ धूप बहुत तेज़ है और मैं छाँव ढूँढ रहा हूँ। क्या तुम्हारे पास छाता है जो तुम ला सको? मैं तुम्हारा इंतज़ार कर रहा हूँ।
जहा रास्ता बंद हो वहा से लौट आना क्या तुम रास्ता जानते हो या नक्शा चाहिए में नहीं चाहता कि तुम कही भटक जाओ और तुम्हे कोई परेशानी हो क्या तुम मेरी बात समझ रहे हो या में फिर से समझाउ,जहाँ रास्ता बंद हो वहाँ से लौट आना। क्या तुम रास्ता जानते हो या नक्शा चाहिए? मैं नहीं चाहता कि तुम कहीं भटक जाओ और तुम्हें कोई परेशानी हो। क्या तुम मेरी बात समझ रहे हो या मैं फिर से समझाऊँ?
गाव में बहुत शांति है क्या तुम चलोगे मा वहा इंतज़ार कर रही है और उन्होंने खीर बनाई है वहा की ताजी हवा और खुला आसमान तुम्हे बहुत पसंद आएगा क्या तुम अपना बैग पैक कर चुके हो,गाँव में बहुत शांति है। क्या तुम चलोगे? माँ वहाँ इंतज़ार कर रही हैं और उन्होंने खीर बनाई है। वहाँ की ताजी हवा और खुला आसमान तुम्हें बहुत पसंद आएगा। क्या तुम अपना बैग पैक कर चुके हो?
मा ने पूछा तुम कहा जा रहे हो क्या तुम बाजार जा रहे हो या दोस्त के घर उन्होंने कहा था कि जल्दी वापस आना क्योंकि रात को हमे एक शादी में जाना है क्या तुम्हे याद है वो शादी,"माँ ने पूछा, ""तुम कहाँ जा रहे हो? क्या तुम बाज़ार जा रहे हो या दोस्त के घर?"" उन्होंने कहा था कि जल्दी वापस आना क्योंकि रात को हमें एक शादी में जाना है। क्या तुम्हें याद है वो शादी?"
जहा तक में देख सकता हु वहा पहाड है क्या तुम देख पा रहे हो वो नजारा वहा की बर्फ और ठंडी हवा मन को बहुत सुकून देती है क्या तुम वहा चढना चाहोगे में तो बहुत उत्साहित हु,जहाँ तक मैं देख सकता हूँ वहाँ पहाड़ हैं। क्या तुम देख पा रहे हो वो नज़ारा? वहाँ की बर्फ और ठंडी हवा मन को बहुत सुकून देती है। क्या तुम वहाँ चढ़ना चाहोगे? मैं तो बहुत उत्साहित हूँ।
में कल आउगा और मा से मिलूगा क्या तुम भी आओगे या तुम्हे काम है मा ने विशेष रूप से तुम्हे बुलाया है क्योंकि वो तुमसे बहुत दिन से नहीं मिली है क्या तुम समय निकाल पाओगे,मैं कल जाऊँगा और माँ से मिलूँगा। क्या तुम भी आओगे या तुम्हें काम hai? माँ ने विशेष रूप से तुम्हें बुलाया है क्योंकि वह तुमसे बहुत दिन से नहीं मिली हैं। क्या तुम समय निकाल पाओगे?
कहा रखा है मेरा सामान जहा में देख सकू क्या तुमने देखा है या चोरी हो गया में उसे कल रात से ढूढ रहा हु और अब मुझे बहुत गुस्सा आ रहा है क्या तुमने कमरे की तलाशी ली,कहाँ रखा है मेरा सामान जहाँ मैं देख सकूँ? क्या तुमने देखा है या चोरी हो गया? मैं उसे कल रात से ढूँढ रहा हूँ और अब मुझे बहुत गुस्सा आ रहा है। क्या तुमने कमरे की तलाशी ली?
में जानता हु कि तुम कहा से आए हो क्या तुम वापस जाओगे या यही रहोगे यहा रहने के लिए बहुत जगह है और मा भी तुम्हे पसंद करती है क्या तुम यहा काम करना चाहोगे,मैं जानता हूँ कि तुम कहाँ से आए हो। क्या तुम वापस जाओगे या यहीं रहोगे? यहाँ रहने के लिए बहुत जगह है और माँ भी तुम्हें पसंद करती हैं। क्या तुम यहाँ काम करना चाहोगे?
मा ने कहा कि में वहा जाउगा क्या तुम तैयार हो या अभी और वक्त चाहिए हमे समय पर स्टेशन पहुचना है वरना ट्रेन छूट जाएगी क्या तुमने अपना सारा सामान ठीक से रख लिया है,माँ ने कहा कि मैं वहाँ जाऊँगा। क्या तुम तैयार हो या अभी और वक्त चाहिए? हमें समय पर स्टेशन पहुँचना है वरना ट्रेन छूट जाएगी। क्या तुमने अपना सारा सामान ठीक से रख लिया है?
जहा तुम खडे हो वहा बहुत फिसलन है क्या तुम गिर तो नहीं गए संभलकर उठो यहा बहुत पानी फैला हुआ है और फर्श बहुत चिकना है क्या तुम्हे चोट तो नहीं लगी में हाथ बढा रहा हु,"जहाँ तुम खड़े हो वहाँ बहुत फिसलन है। क्या तुम गिर तो नहीं गए? संभलकर उठो, यहाँ बहुत पानी फैला हुआ है और फर्श बहुत चिकना है। क्या तुम्हें चोट तो नहीं लगी? मैं हाथ बढ़ा रहा हूँ।"
में कल शहर जाउगा जहा बहुत काम है क्या तुम मेरे साथ चलोगे या में अकेला जाउ वहा मुझे कुछ सरकारी दफ्तरों में जाना है और कुछ कागजात जमा करने है क्या तुम मेरी मदद करोगे,मैं कल शहर जाऊँगा जहाँ बहुत काम है। क्या तुम मेरे साथ चलोगे या मैं अकेला जाऊँ? वहाँ मुझे कुछ सरकारी दफ्तरों में जाना है और कुछ कागजात जमा करने हैं। क्या तुम मेरी मदद करोगे?
मा घर पर है में अभी वहा जा रहा हु क्या तुम भी आओगे या बाद में मिलोगे मा ने कहा था कि उन्हें तुमसे कुछ जारूरी बात करनी है क्या तुम्हे पता है वो क्या बात है,माँ घर पर हैं। मैं अभी वहाँ जा रहा हूँ। क्या तुम भी आओगे या बाद में मिलोगे? माँ ने कहा था कि उन्हें तुमसे कुछ ज़रूरी बात करनी है। क्या तुम्हें पता है वो क्या बात है?
कहा गए थे तुम मा कब से पूछ रही थी क्या तुम ठीक हो या कोई परेशानी है उन्होंने शहर के हर कोने में तुम्हे ढूढने की कोशिश की और अब वो बहुत रो रही है क्या तुम वहा जाओगे,कहाँ गए थे तुम? माँ कब से पूछ रही थीं। क्या तुम ठीक हो या कोई परेशानी है? उन्होंने शहर के हर कोने में तुम्हें ढूँढने की कोशिश की और अब वह बहुत रो रही हैं। क्या तुम वहाँ जाओगे?
में और मा कल शहर जाएगे क्या तुम वहा मिलोगे या हम घर पर मिले हमे वहा से कुछ घर का सामान और राशन लाना है क्या तुम अपनी गाडी ला सकते हो ताकि आसानी हो,मैं और माँ कल शहर जाएंगे। क्या तुम वहाँ मिलोगे या हम घर पर मिलें? हमें वहाँ से कुछ घर का सामान और राशन लाना है। क्या तुम अपनी गाड़ी ला सकते हो ताकि आसानी हो?
जहा रास्ता सही हो वहा चलना चाहिए क्या तुम मेरी बात समझ रहे हो या में फिर समझाउ गलत रास्ते पर चलने से हमेशा मुसीबत आती है और बाद में पछताना पडता है क्या तुम सहमत हो,जहाँ रास्ता सही हो वहाँ चलना चाहिए। क्या तुम मेरी बात समझ रहे हो या मैं फिर समझाऊँ? गलत रास्ते पर चलने से हमेशा मुसीबत आती है और बाद में पछताना पड़ता है। क्या तुम सहमत हो?
में जानता हु कि तुम कहा छिप सकते हो क्या तुम बाहर आओगे या में पुलिस को बुलाउ तुमने जो गलती की है उसकी सजा तो तुम्हे मिलेगी ही पर सच बोलने से सजा कम हो सकती है क्या तुम तैयार हो,"मैं जानता हूँ कि तुम कहाँ छिप सकते हो। क्या तुम बाहर आओगे या मैं पुलिस को बुलाऊँ? तुमने जो गलती की है उसकी सजा तो तुम्हें मिलेगी ही, पर सच बोलने से सजा कम हो सकती है। क्या तुम तैयार हो?"
